[{"title":"Ãœber uns","image":"https://views9online.files.wordpress.com/2018/09/image1.jpg","provider":"webview","arguments":["https://simpleencounterpe.wordpress.com/"]},{"title":"Departments","image":"https://views9online.files.wordpress.com/2018/09/image2.jpg","provider":"webview","arguments":["https://www.pureencounter.com/classes"]},{"title":"Fotos","image":"https://views9online.files.wordpress.com/2018/09/image3.jpg?w=740&zoom=2","provider":"webview","arguments":["https://www.pureencounter.com/gallery"]},{"title":"Kontakt","image":"https://views9online.files.wordpress.com/2018/09/image5.jpg","provider":"webview","arguments":["https://www.pureencounter.com/contact"]},{"title":"Spenden","image":"https://views9online.files.wordpress.com/2018/09/image6.jpg","provider":"webview","arguments":["https://www.paypal.com/donate/?token=HZP8Yd7SMfP6uiS6MBUzVeaUCUwzeN6HLN9Lp8ne02_xPCX5a5uqY94qRia-whEierO1PG&country.x=DE&locale.x="]}] 
